Author,Title,Citations,Venue,Source,cit/year,Title（日本語）
" Elsayed, P Aston, VR Bayanagari…",The gut microbiome molecular mimicry piece in the multiple sclerosis puzzle,2,Frontiers in …,https://www.frontiersin.org/articles/10.3389/fimmu.2022.972160/full,2,多発性硬化症パズルの腸内マイクロバイオーム分子模倣ピース
"Liu, HCH Lau, WY Cheng, J Yu",Gut microbiome in colorectal cancer: Clinical diagnosis and treatment,2,Genomics  Proteomics & Bioinformatics,https://www.sciencedirect.com/science/article/pii/S1672022922000869,2,結腸直腸癌における腸内微生物叢：臨床診断と治療
"Chen, SE Rudolph, BN Longo, F Pace…",Bioengineered 3D tissue model of intestine epithelium with oxygen gradients to sustain human gut microbiome,2,Advanced …,https://onlinelibrary.wiley.com/doi/abs/10.1002/adhm.202200447,2,ヒト腸内微生物叢を維持するために、酸素勾配を備えた腸上皮のバイオエンジニアリング3D組織モデル
" Bongers, R Chanderraj, RJ Woods…",The gut microbiome modulates body temperature both in sepsis and health,2,American Journal of …,https://www.atsjournals.org/doi/abs/10.1164/rccm.202201-0161OC,2,腸内微生物叢は、敗血症と健康の両方で体温を調節します
"FitzGerald, S Patel, J Eckenberger, E Guillemard…",Improved gut microbiome recovery following drug therapy is linked to abundance and replication of probiotic strains,2,Gut …,https://www.tandfonline.com/doi/abs/10.1080/19490976.2022.2094664,2,薬物療法後の腸内微生物叢の回復の改善は、プロバイオティクス株の豊富さと複製に関連しています
" Kumar, S Hogue, J Po",Effects of Green Tea Catechins on Prostate Cancer Chemoprevention: The Role of the Gut Microbiome,2,Cancers,https://www.mdpi.com/1782486,2,前立腺癌化学予防に対する緑茶カテキンの影響：腸内微生物叢の役割
" Brumfield, MJ Raupp, D Haji, C Simon, J Graf…","Gut microbiome insights from 16S rRNA analysis of 17-year periodical cicadas (Hemiptera: Magicicada spp.) Broods II, VI, and X",1,Scientific Reports,https://www.nature.com/articles/s41598-022-20527-7,1,17年の定期的なCICADA（半emi目：Magicicada spp。）BROODS II、VI、およびXの16S RRNA分析からの腸内微生物叢の洞察
" O'Brien, O O'Sullivan, MJ Claesson, PD Cotter",The athlete gut microbiome and its relevance to health and performance: a review,1,Sports Medicine,https://link.springer.com/article/10.1007/s40279-022-01785-x,1,アスリート腸内微生物叢とその健康とパフォーマンスとの関連性：レビュー
"Yang, LY Hung, Y Zhu, S Ding…",Material engineering in gut microbiome and human health,1,…,https://downloads.spj.sciencemag.org/research/2022/9804014.pdf,1,腸内微生物叢と人間の健康における材料工学
Zhang,Influence of Foods and Nutrition on the Gut Microbiome and Implications for Intestinal Health,1,International Journal of Molecular Sciences,https://www.mdpi.com/1792618,1,腸内微生物叢に対する食物と栄養の影響と腸の健康への影響
"Clever, JM Sourisse, RF Preziosi, JA Eisen…",The gut microbiome variability of a butterflyfish increases on severely degraded Caribbean reefs,1,Communications …,https://www.nature.com/articles/s42003-022-03679-0,1,蝶の微生物膜の変動性は、重度の劣化したカリブのサンゴ礁で増加します
" West, X Yin, EM Rutherford, B Wee, J Choi…",Multi-angle meta-analysis of the gut microbiome in Autism Spectrum Disorder: a step toward understanding patient subgroups,1,Scientific Reports,https://www.nature.com/articles/s41598-022-21327-9,1,自閉症スペクトラム障害における腸内微生物叢のマルチアングルメタ分析：患者サブグループを理解するためのステップ
"Zhang, W Zhang, C Feng, LY Kwok, Q He…",Stronger gut microbiome modulatory effects by postbiotics than probiotics in a mouse colitis model,1,npj Science of Food,https://www.nature.com/articles/s41538-022-00169-9,1,マウス大腸炎モデルのプロバイオティクスよりも、ポストバイオティクスによるより強い腸内微生物変調効果
" Peng, Y Sun, S Xiao, J Chen, X Zhou…","… of Polymer Size on Polystyrene Biodegradation in Mealworms (Tenebrio molitor): Responses of Depolymerization Pattern, Gut Microbiome, and Metabolome to …",1,Environmental …,https://pubs.acs.org/doi/abs/10.1021/acs.est.2c06260,1,…食事虫（Tenebrio Molitor）のポリスチレン生分解のポリマーサイズ：脱重度パターン、腸内微生物叢、およびメタボロームの応答…
"Bi, L Feng, J He, C Liu, Y Wang, H Jiang…",Emerging insights between gut microbiome dysbiosis and Parkinson's disease: Pathogenic and clinical relevance,1,Ageing Research …,https://www.sciencedirect.com/science/article/pii/S156816372200201X,1,腸内微生物叢の分散症とパーキンソン病の間の新たな洞察：病原性および臨床的関連性
" Koblinsky, KA Power, L Middleton…",The role of the gut microbiome in diet and exercise effects on cognition: A review of the intervention literature,1,The Journals of …,https://academic.oup.com/biomedgerontology/advance-article/doi/10.1093/gerona/glac166/6670844?itm_medium=sidebar&itm_source=trendmd-widget&itm_campaign=The_Journals_of_Gerontology%253A_Series_A&itm_content=The_Journals_of_Gerontology%253A_Series_A_0,1,食事と運動における腸内ミクロビオームの役割認識への影響：介入文献のレビュー
"Wilmes, C Marti",The gut microbiome molecular complex in human health and disease,1,Cell Host & Microbe,https://www.sciencedirect.com/science/article/pii/S1931312822004152,1,人間の健康と病気における腸内微生物分子複合体